{
  "catalog": {
    "item_count": 4,
    "scope": "train_only",
    "sha256": "d7c89610dadfdf34c6f8d1c1c649f6386cebe6fc31dc525acf7807924cdf889d"
  },
  "content_sha256": "ae9748ffc42fb388bac607fabcbb7fb229ecc735bef9323fb8539eb85e74875a",
  "dataset": {
    "category": "fixture",
    "name": "SyntheticRPG",
    "normalized_name": "syntheticrpg",
    "profile": "unit-test"
  },
  "dataset_id": "rpg:syntheticrpg:4",
  "identity_status": "fully_bound",
  "privacy": {
    "contains_source_item_ids": false,
    "item_identity": "pseudonymous_normalized_items"
  },
  "producer": {
    "name": "sidinspector.contracts",
    "version": "1.2.0.dev0"
  },
  "schema": "sidscope.dataset_identity.v1",
  "schema_revision": "1.0.0",
  "splits": [
    {
      "role": "train",
      "row_count": 2,
      "sha256": "426e275aa3522ba9c46f38bd2d81876c812504b92dedfa37a65a8c41ea1fb5a7",
      "split_id": "synthetic/frozen/train"
    },
    {
      "role": "validation",
      "row_count": 1,
      "sha256": "8f8cce93ad5249604ae6282b8db55bd04dae26186236d22d27b2a0183e624c27",
      "split_id": "synthetic/frozen/validation"
    },
    {
      "role": "test",
      "row_count": 2,
      "sha256": "31ee0fb320ebcdd583997d2b097788b46a95e257b8eaebe45a80796f7a748cdb",
      "split_id": "synthetic/frozen/test"
    }
  ],
  "target_universe": {
    "item_count": 4,
    "scope": "train_only_catalog",
    "sha256": "7417050d74a02afbaa5c46dce666daf57e6ea8f6b37a7d5f85c97bb187e06ff9"
  },
  "unbound_fields": []
}
