{
  "schema": "sidscope.dataset_identity.v1",
  "schema_revision": "1.0.0",
  "dataset_id": "synthetic-rpg.fixture-v1",
  "producer": {"name": "sidinspector.contracts", "version": "1.2.0.dev0"},
  "dataset": {"name": "SyntheticRPG", "normalized_name": "synthetic_rpg", "category": "fixture", "profile": "unit-test"},
  "splits": [
    {"role": "train", "split_id": "synthetic/frozen/train", "sha256": "426e275aa3522ba9c46f38bd2d81876c812504b92dedfa37a65a8c41ea1fb5a7", "row_count": 2},
    {"role": "validation", "split_id": "synthetic/frozen/validation", "sha256": "8f8cce93ad5249604ae6282b8db55bd04dae26186236d22d27b2a0183e624c27", "row_count": 1},
    {"role": "test", "split_id": "synthetic/frozen/test", "sha256": "31ee0fb320ebcdd583997d2b097788b46a95e257b8eaebe45a80796f7a748cdb", "row_count": 2}
  ],
  "catalog": {"scope": "train_only", "item_count": 4, "sha256": "d7c89610dadfdf34c6f8d1c1c649f6386cebe6fc31dc525acf7807924cdf889d"},
  "target_universe": {"scope": "train_only_catalog", "item_count": 4, "sha256": "7417050d74a02afbaa5c46dce666daf57e6ea8f6b37a7d5f85c97bb187e06ff9"},
  "privacy": {"item_identity": "pseudonymous_normalized_items", "contains_source_item_ids": false},
  "identity_status": "fully_bound",
  "unbound_fields": [],
  "content_sha256": "5e8ededa45e478168135458560a3f4c7342ba24da1fe238ea9f508db44b7245b"
}
